{
  "schema_version": "taxonomy-v2-classification/1",
  "slug": "testvot",
  "result_status": "partial",
  "classification": {
    "tip_entitate": "proiect",
    "subiect_principal": "subiect:guvernare-democratie",
    "subiecte": [
      "subiect:guvernare-democratie"
    ],
    "teme": [
      "subiect:alegeri"
    ],
    "scopuri": [
      "scop:informare"
    ],
    "functionalitati": [
      "functie:comparare"
    ],
    "formate": [
      "format:joc-test"
    ],
    "tehnologii": [],
    "institutii_vizate": [],
    "tip_organizatie": [],
    "maturitate": null,
    "nivel_acoperire": "national",
    "arii_acoperite": [
      "tara:RO"
    ]
  },
  "justifications": [
    {
      "field": "tip_entitate",
      "value": "proiect",
      "basis": "identity_preservation",
      "confidence": "mare",
      "evidence": [
        {
          "source_id": "testvot:tip_entitate_original",
          "locator": "clasificare-input.csv:testvot:tip_entitate_original",
          "excerpt": "proiect"
        }
      ],
      "rationale_ro": "Păstrez tipul entității din înregistrarea originală; acesta nu dovedește funcționalități."
    },
    {
      "field": "subiect_principal",
      "value": "subiect:guvernare-democratie",
      "basis": "hierarchy",
      "confidence": "mica",
      "evidence": [
        {
          "source_id": "testvot:descriere_scurta",
          "locator": "clasificare-input.csv:testvot:descriere_scurta",
          "excerpt": "Test de afinitate politică"
        }
      ],
      "rationale_ro": "Testul de afinitate compară poziții politice; pagina fără text nu probează alte funcții. Conceptul subiect:alegeri are acest strămoș în vocabularul înghețat."
    },
    {
      "field": "subiecte",
      "value": "subiect:guvernare-democratie",
      "basis": "hierarchy",
      "confidence": "mica",
      "evidence": [
        {
          "source_id": "testvot:descriere_scurta",
          "locator": "clasificare-input.csv:testvot:descriere_scurta",
          "excerpt": "Test de afinitate politică"
        }
      ],
      "rationale_ro": "Testul de afinitate compară poziții politice; pagina fără text nu probează alte funcții. Conceptul subiect:alegeri are acest strămoș în vocabularul înghețat."
    },
    {
      "field": "teme",
      "value": "subiect:alegeri",
      "basis": "inference",
      "confidence": "mica",
      "evidence": [
        {
          "source_id": "testvot:descriere_scurta",
          "locator": "clasificare-input.csv:testvot:descriere_scurta",
          "excerpt": "Test de afinitate politică"
        }
      ],
      "rationale_ro": "Testul de afinitate compară poziții politice; pagina fără text nu probează alte funcții. Încadrare: Alegeri."
    },
    {
      "field": "scopuri",
      "value": "scop:informare",
      "basis": "inference",
      "confidence": "mica",
      "evidence": [
        {
          "source_id": "testvot:descriere_scurta",
          "locator": "clasificare-input.csv:testvot:descriere_scurta",
          "excerpt": "Test de afinitate politică"
        }
      ],
      "rationale_ro": "Testul de afinitate compară poziții politice; pagina fără text nu probează alte funcții. Încadrare: Informare și înțelegere."
    },
    {
      "field": "functionalitati",
      "value": "functie:comparare",
      "basis": "inference",
      "confidence": "mica",
      "evidence": [
        {
          "source_id": "testvot:descriere_scurta",
          "locator": "clasificare-input.csv:testvot:descriere_scurta",
          "excerpt": "Test de afinitate politică"
        }
      ],
      "rationale_ro": "Testul de afinitate compară poziții politice; pagina fără text nu probează alte funcții. Încadrare: Compară."
    },
    {
      "field": "formate",
      "value": "format:joc-test",
      "basis": "inference",
      "confidence": "mica",
      "evidence": [
        {
          "source_id": "testvot:descriere_scurta",
          "locator": "clasificare-input.csv:testvot:descriere_scurta",
          "excerpt": "Test de afinitate politică"
        }
      ],
      "rationale_ro": "Testul de afinitate compară poziții politice; pagina fără text nu probează alte funcții. Încadrare: Joc sau test."
    },
    {
      "field": "nivel_acoperire",
      "value": "national",
      "basis": "inference",
      "confidence": "medie",
      "evidence": [
        {
          "source_id": "testvot:acoperire_original",
          "locator": "clasificare-input.csv:testvot:acoperire_original",
          "excerpt": "national"
        }
      ],
      "rationale_ro": "Păstrez declarația geografică originală; nu confirm existența datelor pentru fiecare localitate."
    },
    {
      "field": "arii_acoperite",
      "value": "tara:RO",
      "basis": "inference",
      "confidence": "medie",
      "evidence": [
        {
          "source_id": "testvot:acoperire_original",
          "locator": "clasificare-input.csv:testvot:acoperire_original",
          "excerpt": "national"
        }
      ],
      "rationale_ro": "Păstrez declarația geografică originală; nu confirm existența datelor pentru fiecare localitate."
    }
  ],
  "attributions": [
    {
      "predicate": "atribuit_in_sursa",
      "object_slug": null,
      "object_literal": "Median Research Centre",
      "basis": "identity_preservation",
      "confidence": "mare",
      "evidence": [
        {
          "source_id": "testvot:autor_original",
          "locator": "clasificare-input.csv:testvot:autor_original",
          "excerpt": "Median Research Centre"
        }
      ],
      "rationale_ro": "Păstrez atribuirea originală; câmpul autor nu stabilește separat creatorul, editorul sau administratorul."
    }
  ],
  "uncertainties": [
    {
      "field": "maturitate",
      "reason_ro": "Dovezile nu stabilesc fără ambiguitate o etapă de utilizare actuală.",
      "needed_evidence_ro": "Declarație explicită sau documentare a utilizării în condiții reale."
    },
    {
      "field": "classification",
      "reason_ro": "Lipsește descrierea detaliată; titlul, textul scurt și etichetele au precizie limitată.",
      "needed_evidence_ro": "Documentație publică specifică intrării."
    },
    {
      "field": "classification",
      "reason_ro": "Testul de afinitate compară poziții politice; pagina fără text nu probează alte funcții.",
      "needed_evidence_ro": "Documentație primară care rezolvă ambiguitatea indicată."
    },
    {
      "field": "attributions",
      "reason_ro": "Rolurile rămân nespecificate în câmpul original autor.",
      "needed_evidence_ro": "Declarație explicită despre rolul fiecărei persoane sau organizații."
    }
  ],
  "conflicts": [],
  "excluded_legacy_tags": [
    {
      "original_field": "tip",
      "original_value": "educativ",
      "reason_ro": "Etichetă istorică mixtă sau nesusținută suficient; folosesc sensul concret al descrierii și fațetele independente."
    },
    {
      "original_field": "cuvinte",
      "original_value": "vot",
      "reason_ro": "Etichetă istorică mixtă sau nesusținută suficient; folosesc sensul concret al descrierii și fațetele independente."
    }
  ],
  "new_concept_proposals": [],
  "new_area_proposals": []
}
