{
  "schema_version": "taxonomy-v2-classification/1",
  "slug": "ia-statul-la-intrebari",
  "result_status": "classified",
  "classification": {
    "tip_entitate": "proiect",
    "subiect_principal": "subiect:drept-justitie",
    "subiecte": [
      "subiect:drept-justitie"
    ],
    "teme": [
      "subiect:acces-informatii",
      "subiect:legea-544-2001"
    ],
    "scopuri": [
      "scop:transparenta",
      "scop:aparare-drepturi"
    ],
    "functionalitati": [
      "functie:cerere-informatii"
    ],
    "formate": [],
    "tehnologii": [],
    "institutii_vizate": [],
    "tip_organizatie": [],
    "maturitate": null,
    "nivel_acoperire": "national",
    "arii_acoperite": [
      "tara:RO"
    ]
  },
  "justifications": [
    {
      "field": "tip_entitate",
      "value": "proiect",
      "basis": "identity_preservation",
      "confidence": "mare",
      "evidence": [
        {
          "source_id": "ia-statul-la-intrebari:tip_entitate_original",
          "locator": "clasificare-input.csv:ia-statul-la-intrebari:tip_entitate_original",
          "excerpt": "proiect"
        }
      ],
      "rationale_ro": "Păstrez tipul entității din înregistrarea originală; acesta nu dovedește funcționalități."
    },
    {
      "field": "subiect_principal",
      "value": "subiect:drept-justitie",
      "basis": "hierarchy",
      "confidence": "medie",
      "evidence": [
        {
          "source_id": "ia-statul-la-intrebari:descriere_scurta",
          "locator": "clasificare-input.csv:ia-statul-la-intrebari:descriere_scurta",
          "excerpt": "Cereri de informații publice (Legea 544)"
        }
      ],
      "rationale_ro": "Intrarea privește cereri de informații publice; pagina generală a editorului nu dovedește alte funcții. Conceptul subiect:acces-informatii are acest strămoș în vocabularul înghețat."
    },
    {
      "field": "subiecte",
      "value": "subiect:drept-justitie",
      "basis": "hierarchy",
      "confidence": "medie",
      "evidence": [
        {
          "source_id": "ia-statul-la-intrebari:descriere_scurta",
          "locator": "clasificare-input.csv:ia-statul-la-intrebari:descriere_scurta",
          "excerpt": "Cereri de informații publice (Legea 544)"
        }
      ],
      "rationale_ro": "Intrarea privește cereri de informații publice; pagina generală a editorului nu dovedește alte funcții. Conceptul subiect:acces-informatii are acest strămoș în vocabularul înghețat."
    },
    {
      "field": "teme",
      "value": "subiect:acces-informatii",
      "basis": "inference",
      "confidence": "medie",
      "evidence": [
        {
          "source_id": "ia-statul-la-intrebari:descriere_scurta",
          "locator": "clasificare-input.csv:ia-statul-la-intrebari:descriere_scurta",
          "excerpt": "Cereri de informații publice (Legea 544)"
        }
      ],
      "rationale_ro": "Intrarea privește cereri de informații publice; pagina generală a editorului nu dovedește alte funcții. Încadrare: Acces la informații publice."
    },
    {
      "field": "teme",
      "value": "subiect:legea-544-2001",
      "basis": "inference",
      "confidence": "medie",
      "evidence": [
        {
          "source_id": "ia-statul-la-intrebari:descriere_scurta",
          "locator": "clasificare-input.csv:ia-statul-la-intrebari:descriere_scurta",
          "excerpt": "Cereri de informații publice (Legea 544)"
        }
      ],
      "rationale_ro": "Intrarea privește cereri de informații publice; pagina generală a editorului nu dovedește alte funcții. Încadrare: Legea 544/2001."
    },
    {
      "field": "scopuri",
      "value": "scop:transparenta",
      "basis": "inference",
      "confidence": "medie",
      "evidence": [
        {
          "source_id": "ia-statul-la-intrebari:descriere_scurta",
          "locator": "clasificare-input.csv:ia-statul-la-intrebari:descriere_scurta",
          "excerpt": "Cereri de informații publice (Legea 544)"
        }
      ],
      "rationale_ro": "Intrarea privește cereri de informații publice; pagina generală a editorului nu dovedește alte funcții. Încadrare: Transparență."
    },
    {
      "field": "scopuri",
      "value": "scop:aparare-drepturi",
      "basis": "inference",
      "confidence": "medie",
      "evidence": [
        {
          "source_id": "ia-statul-la-intrebari:descriere_scurta",
          "locator": "clasificare-input.csv:ia-statul-la-intrebari:descriere_scurta",
          "excerpt": "Cereri de informații publice (Legea 544)"
        }
      ],
      "rationale_ro": "Intrarea privește cereri de informații publice; pagina generală a editorului nu dovedește alte funcții. Încadrare: Apărarea drepturilor."
    },
    {
      "field": "functionalitati",
      "value": "functie:cerere-informatii",
      "basis": "inference",
      "confidence": "medie",
      "evidence": [
        {
          "source_id": "ia-statul-la-intrebari:descriere_scurta",
          "locator": "clasificare-input.csv:ia-statul-la-intrebari:descriere_scurta",
          "excerpt": "Cereri de informații publice (Legea 544)"
        }
      ],
      "rationale_ro": "Intrarea privește cereri de informații publice; pagina generală a editorului nu dovedește alte funcții. Încadrare: Solicită informații publice."
    },
    {
      "field": "nivel_acoperire",
      "value": "national",
      "basis": "inference",
      "confidence": "medie",
      "evidence": [
        {
          "source_id": "ia-statul-la-intrebari:acoperire_original",
          "locator": "clasificare-input.csv:ia-statul-la-intrebari:acoperire_original",
          "excerpt": "national"
        }
      ],
      "rationale_ro": "Păstrez declarația geografică originală; nu confirm existența datelor pentru fiecare localitate."
    },
    {
      "field": "arii_acoperite",
      "value": "tara:RO",
      "basis": "inference",
      "confidence": "medie",
      "evidence": [
        {
          "source_id": "ia-statul-la-intrebari:acoperire_original",
          "locator": "clasificare-input.csv:ia-statul-la-intrebari:acoperire_original",
          "excerpt": "national"
        }
      ],
      "rationale_ro": "Păstrez declarația geografică originală; nu confirm existența datelor pentru fiecare localitate."
    }
  ],
  "attributions": [
    {
      "predicate": "atribuit_in_sursa",
      "object_slug": null,
      "object_literal": "Alianța pentru o Românie Curată",
      "basis": "identity_preservation",
      "confidence": "mare",
      "evidence": [
        {
          "source_id": "ia-statul-la-intrebari:autor_original",
          "locator": "clasificare-input.csv:ia-statul-la-intrebari:autor_original",
          "excerpt": "Alianța pentru o Românie Curată"
        }
      ],
      "rationale_ro": "Păstrez atribuirea originală; câmpul autor nu stabilește separat creatorul, editorul sau administratorul."
    }
  ],
  "uncertainties": [
    {
      "field": "maturitate",
      "reason_ro": "Dovezile nu stabilesc fără ambiguitate o etapă de utilizare actuală.",
      "needed_evidence_ro": "Declarație explicită sau documentare a utilizării în condiții reale."
    },
    {
      "field": "classification",
      "reason_ro": "Lipsește descrierea detaliată; titlul, textul scurt și etichetele au precizie limitată.",
      "needed_evidence_ro": "Documentație publică specifică intrării."
    },
    {
      "field": "attributions",
      "reason_ro": "Rolurile rămân nespecificate în câmpul original autor.",
      "needed_evidence_ro": "Declarație explicită despre rolul fiecărei persoane sau organizații."
    }
  ],
  "conflicts": [],
  "excluded_legacy_tags": [
    {
      "original_field": "tip",
      "original_value": "instrument",
      "reason_ro": "Etichetă istorică mixtă sau nesusținută suficient; folosesc sensul concret al descrierii și fațetele independente."
    },
    {
      "original_field": "cuvinte",
      "original_value": "legislație",
      "reason_ro": "Etichetă istorică mixtă sau nesusținută suficient; folosesc sensul concret al descrierii și fațetele independente."
    },
    {
      "original_field": "cuvinte",
      "original_value": "legea-544",
      "reason_ro": "Etichetă istorică mixtă sau nesusținută suficient; folosesc sensul concret al descrierii și fațetele independente."
    }
  ],
  "new_concept_proposals": [],
  "new_area_proposals": []
}
